{
  "$schema": "http://json-schema.org/draft-07/schema#",
  "$id": "screens/schema/card_skin.schema.json",
  "title": "Battle Hand-Card Skin",
  "description": "Semantic source of truth for how cards render in the battle hand: card box geometry, per battle-card-type weapon icon + CGB palette, per element-status icon + palette. The JSON->C compiler emits the const g_card_skin (bank 4) that is staged into WRAM at battle entry. Icons resolve to the fixed VRAM icon tiles ui_init loads (UI_TILE_CARD_* 104-112); colors to UI_COLOR_* palette indices.",
  "type": "object",
  "additionalProperties": false,
  "required": ["id", "label", "box", "types", "elements"],
  "properties": {
    "id": {
      "type": "string",
      "const": "card_skin",
      "description": "Singleton id (one skin per game)."
    },
    "label": {
      "type": "string",
      "maxLength": 40,
      "description": "Human-readable label for the editor."
    },
    "box": {
      "type": "object",
      "additionalProperties": false,
      "required": ["w", "h"],
      "properties": {
        "w": {
          "type": "integer",
          "const": 3,
          "description": "Card box width in tiles. Fixed at 3: the hand lays 5 boxes on a stride-4 column grid (3 box + 1 gap = 20 columns)."
        },
        "h": {
          "type": "integer",
          "minimum": 3,
          "maximum": 5,
          "description": "Card box height in tiles (rows). The first interior row carries the weapon icon, the last interior row the power digit; the element-status icon floats one row above the top-right corner. cards_row (battle screen hud_layout) is the BOTTOM row; the box occupies cards_row-h+1 .. cards_row."
        }
      }
    },
    "types": {
      "type": "object",
      "additionalProperties": false,
      "required": ["sword", "shield", "bow", "heal", "dagger"],
      "description": "Per BattleCardType (src/battle/card.h order SWORD SHIELD BOW HEAL DAGGER).",
      "properties": {
        "sword":  { "$ref": "#/definitions/typeSkin" },
        "shield": { "$ref": "#/definitions/typeSkin" },
        "bow":    { "$ref": "#/definitions/typeSkin" },
        "heal":   { "$ref": "#/definitions/typeSkin" },
        "dagger": { "$ref": "#/definitions/typeSkin" }
      }
    },
    "elements": {
      "type": "object",
      "additionalProperties": false,
      "required": ["fire", "ice", "poison"],
      "description": "Per element-status rider (JSON 'fire' = STATUS_BURN, 'ice' = STATUS_FREEZE, 'poison' = STATUS_POISON). Cards with no rider show a blank status cell.",
      "properties": {
        "fire":   { "$ref": "#/definitions/typeSkin" },
        "ice":    { "$ref": "#/definitions/typeSkin" },
        "poison": { "$ref": "#/definitions/typeSkin" }
      }
    }
  },
  "definitions": {
    "typeSkin": {
      "type": "object",
      "additionalProperties": false,
      "required": ["icon", "color"],
      "properties": {
        "icon": {
          "type": "string",
          "enum": ["sword", "shield", "bow", "dagger", "ring", "amulet", "fire", "ice", "poison"],
          "description": "Which VRAM icon tile represents this type/element in the battle hand."
        },
        "color": {
          "type": "string",
          "enum": ["none", "fire", "iron", "field", "poison", "wood", "gold", "dim"],
          "description": "CGB BG palette index (UI_COLOR_*) applied to the box/icons. On DMG this only affects shade grouping."
        }
      }
    }
  }
}
