{
 "$schema": "./schema/card_skin.schema.json",
 "id": "card_skin",
 "label": "Battle Hand-Card Skin",
 "box": { "w": 3, "h": 4 },
 "types": {
  "sword":  { "icon": "sword",  "color": "iron"   },
  "shield": { "icon": "shield", "color": "wood"   },
  "bow":    { "icon": "bow",    "color": "gold"   },
  "heal":   { "icon": "ring",   "color": "wood"   },
  "dagger": { "icon": "dagger", "color": "poison" }
 },
 "elements": {
  "fire":   { "icon": "fire",   "color": "fire"   },
  "ice":    { "icon": "ice",    "color": "iron"   },
  "poison": { "icon": "poison", "color": "poison" }
 }
}
